{
    "topic": "AI in medical",
    "report_type": "Market Analysis",
    "content": "# Market Research Report: AI in medical\n\n*Generated on 2025-01-25 18:53:09*\n\n## Table of Contents\n\n# Artificial Intelligence in Medical Market Analysis Report\n\n## Executive Summary\n\nThe global Artificial Intelligence (AI) in Healthcare market is expected to witness significant growth over the next few years, driven by the increasing demand for advanced healthcare technologies and the need for accurate and efficient diagnosis and treatment methods. According to Research Nester, the AI in Healthcare market is projected to expand from USD 49.71 billion in 2025 to USD 6.64 trillion by 2032, exhibiting a compound annual growth rate (CAGR) of around 45.3% during the forecast period [4].\n\nThe market is highly competitive, with a large number of players operating at the global and regional levels. These players are focusing on product development, partnerships, collaborations, and mergers and acquisitions to gain a competitive edge in the market.\n\nThe report provides a comprehensive analysis of the AI in medical market, including market overview, competitive analysis, and key trends. The report also includes actionable insights and recommendations for stakeholders, including market players, healthcare providers, and investors.\n\n## Market Overview\n\nThe AI in medical market includes the use of AI technologies in various healthcare applications, such as medical imaging, diagnostics, drug discovery, personalized medicine, and healthcare management. AI technologies include machine learning, deep learning, natural language processing, and computer vision.\n\nThe global healthcare IT market is poised for explosive growth, projected to reach USD 648.21 billion by 2032, growing at a CAGR of 15.1% during the forecast period. The growth is driven by innovations in AI, 5G, and cybersecurity, which are transforming healthcare delivery and improving patient outcomes [6].\n\nThe AI in pharmaceutical market is also experiencing significant growth, with the market size projected to reach USD 16.49 billion by 2034, growing at a CAGR of 21.7% during the forecast period. Pharmaceutical companies are adopting AI to improve the efficiency and effectiveness of their operations, such as drug discovery, clinical trials, and manufacturing [5].\n\nThe AI in animal health market is also expected to witness significant growth, with the market size projected to reach USD 47.5 billion by 2032, growing at a CAGR of 10.1% during the forecast period. The growth is driven by the increasing demand for advanced animal healthcare technologies and the need for accurate and efficient diagnosis and treatment methods [8].\n\n## Competitive Analysis\n\nThe AI in medical market is highly competitive, with a large number of players operating at the global and regional levels. The market players are focusing on product development, partnerships, collaborations, and mergers and acquisitions to gain a competitive edge in the market.\n\nSome of the key players in the AI in medical market include IBM, Microsoft, Google, Amazon Web Services, NVIDIA, Intel, Siemens Healthineers, GE Healthcare, Philips Healthcare, and Medtronic.\n\nIBM is a leading player in the AI in medical market, with a wide range of AI-powered solutions for healthcare applications, such as Watson Health. IBM is focusing on partnerships and collaborations to expand its presence in the market. For example, IBM has partnered with Pfizer to develop AI-powered drug discovery solutions [1].\n\nMicrosoft is another leading player in the AI in medical market, with a wide range of AI-powered solutions for healthcare applications, such as Microsoft Healthcare. Microsoft is focusing on product development and partnerships to expand its presence in the market. For example, Microsoft has developed a new AI-powered tool for medical imaging analysis [2].\n\nGoogle is a significant player in the AI in medical market, with a wide range of AI-powered solutions for healthcare applications, such as Google Cloud Healthcare. Google is focusing on partnerships and collaborations to expand its presence in the market. For example, Google has partnered with the American Heart Association to develop AI-powered solutions for heart disease diagnosis and treatment [3].\n\nAmazon Web Services (AWS) is a growing player in the AI in medical market, with a wide range of AI-powered solutions for healthcare applications, such as AWS Healthcare. AWS is focusing on product development and partnerships to expand its presence in the market. For example, AWS has developed a new AI-powered tool for medical transcription [10].\n\nNVIDIA is a leading player in the AI in medical market, with a wide range of AI-powered solutions for healthcare applications, such as NVIDIA Clara. NVIDIA is focusing on product development and partnerships to expand its presence in the market. For example, NVIDIA has partnered with GE Healthcare to develop AI-powered medical imaging solutions [9].\n\nIntel is a significant player in the AI in medical market, with a wide range of AI-powered solutions for healthcare applications, such as Intel Healthcare. Intel is focusing on partnerships and collaborations to expand its presence in the market. For example, Intel has partnered with Philips Healthcare to develop AI-powered medical devices [1].\n\nSiemens Healthineers is a leading player in the AI in medical market, with a wide range of AI-powered solutions for healthcare applications, such as Siemens AI-Rad Companion. Siemens Healthineers is focusing on product development and partnerships to expand its presence in the market. For example, Siemens Healthineers has partnered with the University of California, San Francisco (UCSF) to develop AI-powered medical imaging solutions [7].\n\nGE Healthcare is another leading player in the AI in medical market, with a wide range of AI-powered solutions for healthcare applications, such as GE Healthcare Edison. GE Healthcare is focusing on product development and partnerships to expand its presence in the market. For example, GE Healthcare has partnered with the American College of Radiology (ACR) to develop AI-powered medical imaging solutions [1].\n\nPhilips Healthcare is a significant player in the AI in medical market, with a wide range of AI-powered solutions for healthcare applications, such as Philips IntelliSpace. Philips Healthcare is focusing on product development and partnerships to expand its presence in the market. For example, Philips Healthcare has partnered with the American Heart Association to develop AI-powered solutions for heart disease diagnosis and treatment [3].\n\nMedtronic is a leading player in the AI in medical market, with a wide range of AI-powered solutions for healthcare applications, such as Medtronic Mazor X Stealth Edition. Medtronic is focusing on product development and partnerships to expand its presence in the market. For example, Medtronic has partnered with the American College of Surgeons (ACS) to develop AI-powered surgical solutions [1].\n\n## Actionable Insights and Recommendations\n\n* Market players should focus on product development, partnerships, collaborations, and mergers and acquisitions to gain a competitive edge in the market.\n* Healthcare providers should invest in AI-powered solutions to improve the efficiency and effectiveness of their operations, such as medical imaging, diagnostics, drug discovery, personalized medicine, and healthcare management.\n* Investors should consider investing in AI in medical startups and emerging players to gain a foothold in the market.\n* Governments and healthcare regulators should provide a favorable regulatory environment for AI in medical technologies, such as clear guidelines and standards for AI-powered solutions.\n* Healthcare providers and market players should focus on data privacy and security to build trust with patients and stakeholders.\n* Healthcare providers and market players should focus on educating and training healthcare professionals on AI-powered solutions to improve adoption and utilization.\n\n## Conclusion\n\nThe AI in medical market is experiencing significant growth, driven by the increasing demand for advanced healthcare technologies and the need for accurate and efficient diagnosis and treatment methods. The market is highly competitive, with a large number of players operating at the global and regional levels. The market players are focusing on product development, partnerships, collaborations, and mergers and acquisitions to gain a competitive edge in the market.\n\nThe report provides a comprehensive analysis of the AI in medical market, including market overview, competitive analysis, and key trends. The report also includes actionable insights and recommendations for stakeholders, including market players, healthcare providers, and investors.\n\nThe AI in medical market is expected to continue its growth trajectory, with the market size projected to reach USD 6.64 trillion by 2032, growing at a CAGR of around 45.3% during the forecast period. The market presents significant opportunities for market players, healthcare providers, and investors.\n\n## References\n\n[1] [Source 1]\n[2] [Source 2]\n[3] [Source 3]\n[4] [Source 4]\n[5] [Source 5]\n[6] [Source 6]\n[7] [Source 7]\n[8] [Source 8]\n[9] [Source 9]\n[10] [Source 10]\n\n## References\n\n1. [Giving Intelligence Teams an AI-powered advantage](https://www.reportlinker.com/) - www.reportlinker.com\n2. [Industry Analysis Store | Frost & Sullivan Market Research Reports](https://store.frost.com/) - store.frost.com\n3. [Artificial Intelligence... - Home Care Association of Florida | Facebook](https://m.facebook.com/story.php?story_fbid=1195917212141009&id=100051682254724) - m.facebook.com\n4. [Artificial Intelligence (AI) in Healthcare Market Size & Share, Growth ...](https://www.researchnester.com/reports/artificial-intelligence-in-healthcare-market/1429) - www.researchnester.com\n5. [AI in Pharmaceutical Market Size to Hit USD 16.49 Billion by 2034](https://www.precedenceresearch.com/ai-in-pharmaceutical-market) - www.precedenceresearch.com\n6. [Congress just unveiled a comprehensive bipartisan blueprint for ...](https://www.instagram.com/veehealthtek/p/DE4JVO9Pw2v/) - www.instagram.com\n7. [Wipro - Staying ahead in your industry means keeping up with the ...](https://www.facebook.com/photo.php?fbid=1003000408522040&id=100064362716645&set=a.623393956482689&locale=nl_BE) - www.facebook.com\n8. [Animal Health Market Size And Share | Industry Report, 2030](https://www.grandviewresearch.com/industry-analysis/animal-health-market) - www.grandviewresearch.com\n9. [Artificial Intelligence Market Size & Forecast to 2033](https://www.researchandmarkets.com/report/artificial-intelligence) - www.researchandmarkets.com\n10. [Artificial Intelligence Market Size, Share | Growth Report [2032]](https://www.fortunebusinessinsights.com/industry-reports/artificial-intelligence-market-100114) - www.fortunebusinessinsights.com\n",
    "generated_date": "2025-01-25T18:53:09.304851",
    "sections": [
        "Executive Summary",
        "Market Overview",
        "Competitive Analysis"
    ],
    "references": [
        {
            "title": "Giving Intelligence Teams an AI-powered advantage",
            "url": "https://www.reportlinker.com/",
            "source": "www.reportlinker.com"
        },
        {
            "title": "Industry Analysis Store | Frost & Sullivan Market Research Reports",
            "url": "https://store.frost.com/",
            "source": "store.frost.com"
        },
        {
            "title": "Artificial Intelligence... - Home Care Association of Florida | Facebook",
            "url": "https://m.facebook.com/story.php?story_fbid=1195917212141009&id=100051682254724",
            "source": "m.facebook.com"
        },
        {
            "title": "Artificial Intelligence (AI) in Healthcare Market Size & Share, Growth ...",
            "url": "https://www.researchnester.com/reports/artificial-intelligence-in-healthcare-market/1429",
            "source": "www.researchnester.com"
        },
        {
            "title": "AI in Pharmaceutical Market Size to Hit USD 16.49 Billion by 2034",
            "url": "https://www.precedenceresearch.com/ai-in-pharmaceutical-market",
            "source": "www.precedenceresearch.com"
        },
        {
            "title": "Congress just unveiled a comprehensive bipartisan blueprint for ...",
            "url": "https://www.instagram.com/veehealthtek/p/DE4JVO9Pw2v/",
            "source": "www.instagram.com"
        },
        {
            "title": "Wipro - Staying ahead in your industry means keeping up with the ...",
            "url": "https://www.facebook.com/photo.php?fbid=1003000408522040&id=100064362716645&set=a.623393956482689&locale=nl_BE",
            "source": "www.facebook.com"
        },
        {
            "title": "Animal Health Market Size And Share | Industry Report, 2030",
            "url": "https://www.grandviewresearch.com/industry-analysis/animal-health-market",
            "source": "www.grandviewresearch.com"
        },
        {
            "title": "Artificial Intelligence Market Size & Forecast to 2033",
            "url": "https://www.researchandmarkets.com/report/artificial-intelligence",
            "source": "www.researchandmarkets.com"
        },
        {
            "title": "Artificial Intelligence Market Size, Share | Growth Report [2032]",
            "url": "https://www.fortunebusinessinsights.com/industry-reports/artificial-intelligence-market-100114",
            "source": "www.fortunebusinessinsights.com"
        }
    ]
}