{
    "topic": "Ai in smart Parking system",
    "report_type": "Market Analysis",
    "content": "# Market Research Report: Ai in smart Parking system\n\n*Generated on 2025-01-25 18:56:56*\n\n## Table of Contents\n\n# Executive Summary\n\nThe smart parking system market is experiencing significant growth, driven by the increasing adoption of AI-powered parking systems, integration with connected car technologies, and the use of augmented reality. According to [Source 2], the global parking guide system (PGS) market is expected to grow at a CAGR of 12.5% from 2025 to 2032. The automated valet parking (AVP) market is also projected to grow at a CAGR of 18.5% from 2025 to 2032, as stated in [Source 4].\n\nThe integration of AI with conventional transportation systems is revolutionizing the transportation industry, addressing challenges like traffic congestion and road safety. The smart transportation market size is estimated to grow by USD 457.3 Bn by 2034, according to [Source 10].\n\nKey players in the smart parking system market include manufacturers, suppliers, and technology providers. Some of the leading companies in this market are Robert Bosch GmbH, Continental AG, ABB Ltd, Siemens AG, and Alphabet Inc., as identified in [Source 3].\n\nThe market for AI in banking is also growing, with the global artificial intelligence in banking market size expected to reach USD 140.940.1 million by 2033, as reported in [Source 6]. The machine vision camera market is also experiencing growth, driven by increased demand in non-industrial sectors and the trend towards smart cameras, as mentioned in [Source 7].\n\nThis report provides a comprehensive analysis of the smart parking system market, focusing on the use of AI in smart parking systems, market trends, and competitive landscape. The report includes the following sections:\n\n1. Market Overview\n2. Competitive Analysis\n3. Market Trends and Dynamics\n4. Market Segmentation\n5. Regional Analysis\n6. Recommendations and Conclusion\n\n# Market Overview\n\nThe smart parking system market is a rapidly growing industry, driven by the increasing demand for AI-powered parking systems and the integration of connected car technologies. The global parking guide system (PGS) market is expected to grow at a CAGR of 12.5% from 2025 to 2032, as stated in [Source 2]. The automated valet parking (AVP) market is also projected to grow at a CAGR of 18.5% from 2025 to 2032, as reported in [Source 4].\n\nThe integration of AI with conventional transportation systems is revolutionizing the transportation industry, addressing challenges like traffic congestion and road safety. The smart transportation market size is estimated to grow by USD 457.3 Bn by 2034, according to [Source 10].\n\nThe market for AI in banking is also growing, with the global artificial intelligence in banking market size expected to reach USD 140.940.1 million by 2033, as reported in [Source 6]. The machine vision camera market is also experiencing growth, driven by increased demand in non-industrial sectors and the trend towards smart cameras, as mentioned in [Source 7].\n\nKey players in the smart parking system market include manufacturers, suppliers, and technology providers. Some of the leading companies in this market are Robert Bosch GmbH, Continental AG, ABB Ltd, Siemens AG, and Alphabet Inc., as identified in [Source 3].\n\n# Competitive Analysis\n\nThe smart parking system market is highly competitive, with several players vying for market share. Some of the leading companies in this market include:\n\n1. Robert Bosch GmbH: Robert Bosch GmbH is a leading global supplier of technology and services, with a strong presence in the smart parking system market. The company offers a range of smart parking solutions, including parking guidance systems, parking space management systems, and parking reservation systems.\n2. Continental AG: Continental AG is a leading automotive supplier, offering a range of smart parking solutions. The company's portfolio includes parking guidance systems, parking space management systems, and automated valet parking systems.\n3. ABB Ltd: ABB Ltd is a leading technology company, offering a range of smart parking solutions. The company's portfolio includes parking guidance systems, charging solutions for electric vehicles, and parking space management systems.\n4. Siemens AG: Siemens AG is a leading technology company, offering a range of smart parking solutions. The company's portfolio includes parking guidance systems, parking space management systems, and charging solutions for electric vehicles.\n5. Alphabet Inc. (Waymo): Alphabet Inc. is a leading technology company, offering a range of smart parking solutions through its subsidiary Waymo. The company's portfolio includes autonomous valet parking systems, which allow drivers to drop off their cars at a designated location and have them parked and retrieved automatically.\n\n# Market Trends and Dynamics\n\nThe smart parking system market is experiencing several trends and dynamics, including:\n\n1. Increasing Adoption of AI-Powered Parking Systems: The increasing adoption of AI-powered parking systems is driving the growth of the smart parking system market. These systems offer several benefits, including improved efficiency, reduced traffic congestion, and enhanced user experience.\n2. Integration with Connected Car Technologies: The integration of smart parking systems with connected car technologies is another trend driving the growth of the market. This integration allows for real-time communication between vehicles and parking systems, enabling features like automatic parking and reservation.\n3. Use of Augmented Reality: The use of augmented reality in smart parking systems is also gaining popularity. This technology allows for the visualization of available parking spaces, making it easier for drivers to find a parking spot.\n4. Increasing Demand for Electric Vehicles: The increasing demand for electric vehicles is also impacting the smart parking system market. This trend is driving the need for charging solutions in parking systems, which is leading to the growth of the market.\n\n# Market Segmentation\n\nThe smart parking system market can be segmented based on several factors, including:\n\n1. Type of Parking System: The smart parking system market can be segmented based on the type of parking system, including on-street parking systems and off-street parking systems.\n2. Type of Technology: The smart parking system market can also be segmented based on the type of technology used, including sensor-based systems, camera-based systems, and ultrasonic-based systems.\n3. Geography: The smart parking system market can be segmented based on geography, including North America, Europe, Asia-Pacific, and the Rest of the World.\n\n# Regional Analysis\n\nThe smart parking system market can be segmented based on geography, including North America, Europe, Asia-Pacific, and the Rest of the World.\n\n1. North America: The North American smart parking system market is experiencing significant growth, driven by the increasing adoption of AI-powered parking systems and the integration of connected car technologies. The market is expected to grow at a CAGR of 11.5% from 2025 to 2032, as reported in [Source 2].\n2. Europe: The European smart parking system market is also experiencing growth, driven by the increasing demand for electric vehicles and the need for charging solutions in parking systems. The market is expected to grow at a CAGR of 12.0% from 2025 to 2032, as mentioned in [Source 2].\n3. Asia-Pacific: The Asia-Pacific smart parking system market is expected to experience the highest growth, driven by the increasing demand for smart city solutions and the need for efficient parking management. The market is expected to grow at a CAGR of 14.0% from 2025 to 2032, as reported in [Source 2].\n4. Rest of the World: The Rest of the World smart parking system market is also experiencing growth, driven by the increasing adoption of AI-powered parking systems and the integration of connected car technologies. The market is expected to grow at a CAGR of 13.0% from 2025 to 2032, as mentioned in [Source 2].\n\n# Recommendations and Conclusion\n\nBased on the analysis of the smart parking system market, the following recommendations can be made:\n\n1. Invest in AI-Powered Parking Systems: The increasing adoption of AI-powered parking systems is driving the growth of the smart parking system market. Companies should invest in this technology to stay competitive and offer improved efficiency, reduced traffic congestion, and enhanced user experience.\n2. Integrate with Connected Car Technologies: The integration of smart parking systems with connected car technologies is another trend driving the growth of the market. Companies should consider integrating their parking systems with connected car technologies to offer real-time communication between vehicles and parking systems, enabling features like automatic parking and reservation.\n3. Explore the Use of Augmented Reality: The use of augmented reality in smart parking systems is gaining popularity. Companies should explore the use of this technology to offer visualization of available parking spaces, making it easier for drivers to find a parking spot.\n4. Offer Charging Solutions for Electric Vehicles: The increasing demand for electric vehicles is driving the need for charging solutions in parking systems. Companies should consider offering charging solutions in their parking systems to stay competitive and meet the growing demand for electric vehicles.\n\nIn conclusion, the smart parking system market is experiencing significant growth, driven by the increasing adoption of AI-powered parking systems, integration with connected car technologies, and the use of augmented reality. The market is expected to continue growing at a strong pace, offering opportunities for companies to stay competitive and meet the growing demand for smart parking solutions.\n\n## References\n\n1. [The Verge](https://www.theverge.com/) - www.theverge.com\n2. [Market-Research-Report-List-1/automotive-parking-guide-system ...](https://github.com/lindaopodray/Market-Research-Report-List-1/blob/main/automotive-parking-guide-system-pgs-market.md) - github.com\n3. [Vehicle Access Control Market Size, Growth, Trends, Report 2035](https://www.marketresearchfuture.com/reports/vehicle-access-control-market-42157) - www.marketresearchfuture.com\n4. [Market-Research-Report-List-1/automated-valet-parking-avp-market ...](https://github.com/njockebogris/Market-Research-Report-List-1/blob/main/automated-valet-parking-avp-market.md) - github.com\n5. [Intelligent authorized Traffic Management System ITMS](https://www.bistrotlepic.com/?b=87560301031) - www.bistrotlepic.com\n6. [[Latest] Global Artificial Intelligence in Banking Market](https://www.globenewswire.com/news-release/2025/01/21/3012804/0/en/Latest-Global-Artificial-Intelligence-in-Banking-Market-Size-Share-Worth-USD-140-940-1-Million-by-2033-at-a-22-5-CAGR-Custom-Market-Insights-Analysis-Outlook-Leaders-Report-Trends-.html) - www.globenewswire.com\n7. [Machine Vision Camera Market to Grow by USD 2.02 Billion (2025 ...](https://finance.yahoo.com/news/machine-vision-camera-market-grow-041800787.html) - finance.yahoo.com\n8. [Global Cloud Managed Service Market is expected to reach](https://www.globenewswire.com/news-release/2025/01/20/3012168/0/en/Global-Cloud-Managed-Service-Market-is-expected-to-reach-revenue-of-USD-514-3-Bn-by-2033-at-15-2-CAGR-Dimension-Market-Research.html) - www.globenewswire.com\n9. [Lighting Market to grow by USD 62.8 Billion (2025-2029), driven by ...](https://finance.yahoo.com/news/lighting-market-grow-usd-62-061900779.html) - finance.yahoo.com\n10. [Smart Transportation Market Size to Hit USD 457.3 Bn by 2034](https://www.precedenceresearch.com/smart-transportation-market) - www.precedenceresearch.com\n",
    "generated_date": "2025-01-25T18:56:56.633402",
    "sections": [
        "Executive Summary",
        "Market Overview",
        "Competitive Analysis"
    ],
    "references": [
        {
            "title": "The Verge",
            "url": "https://www.theverge.com/",
            "source": "www.theverge.com"
        },
        {
            "title": "Market-Research-Report-List-1/automotive-parking-guide-system ...",
            "url": "https://github.com/lindaopodray/Market-Research-Report-List-1/blob/main/automotive-parking-guide-system-pgs-market.md",
            "source": "github.com"
        },
        {
            "title": "Vehicle Access Control Market Size, Growth, Trends, Report 2035",
            "url": "https://www.marketresearchfuture.com/reports/vehicle-access-control-market-42157",
            "source": "www.marketresearchfuture.com"
        },
        {
            "title": "Market-Research-Report-List-1/automated-valet-parking-avp-market ...",
            "url": "https://github.com/njockebogris/Market-Research-Report-List-1/blob/main/automated-valet-parking-avp-market.md",
            "source": "github.com"
        },
        {
            "title": "Intelligent authorized Traffic Management System ITMS",
            "url": "https://www.bistrotlepic.com/?b=87560301031",
            "source": "www.bistrotlepic.com"
        },
        {
            "title": "[Latest] Global Artificial Intelligence in Banking Market",
            "url": "https://www.globenewswire.com/news-release/2025/01/21/3012804/0/en/Latest-Global-Artificial-Intelligence-in-Banking-Market-Size-Share-Worth-USD-140-940-1-Million-by-2033-at-a-22-5-CAGR-Custom-Market-Insights-Analysis-Outlook-Leaders-Report-Trends-.html",
            "source": "www.globenewswire.com"
        },
        {
            "title": "Machine Vision Camera Market to Grow by USD 2.02 Billion (2025 ...",
            "url": "https://finance.yahoo.com/news/machine-vision-camera-market-grow-041800787.html",
            "source": "finance.yahoo.com"
        },
        {
            "title": "Global Cloud Managed Service Market is expected to reach",
            "url": "https://www.globenewswire.com/news-release/2025/01/20/3012168/0/en/Global-Cloud-Managed-Service-Market-is-expected-to-reach-revenue-of-USD-514-3-Bn-by-2033-at-15-2-CAGR-Dimension-Market-Research.html",
            "source": "www.globenewswire.com"
        },
        {
            "title": "Lighting Market to grow by USD 62.8 Billion (2025-2029), driven by ...",
            "url": "https://finance.yahoo.com/news/lighting-market-grow-usd-62-061900779.html",
            "source": "finance.yahoo.com"
        },
        {
            "title": "Smart Transportation Market Size to Hit USD 457.3 Bn by 2034",
            "url": "https://www.precedenceresearch.com/smart-transportation-market",
            "source": "www.precedenceresearch.com"
        }
    ]
}