{
    "topic": "AI in ITAM",
    "report_type": "Trend Analysis",
    "content": "# Market Research Report: AI in ITAM\n\n*Generated on 2025-01-25 19:02:20*\n\n## Table of Contents\n\n**Trend Analysis Report: AI in ITAM**\n======================================================\n\n**Executive Summary**\n---------------------\n\nThe integration of Artificial Intelligence (AI) in IT Asset Management (ITAM) is transforming the way organizations manage their IT assets. This report provides an in-depth analysis of the current market trends, competitive landscape, and future outlook of AI in ITAM. Our research findings indicate that the AI in ITAM market is expected to grow significantly, driven by the increasing need for automation, efficiency, and cost savings in IT asset management.\n\n**Market Overview**\n-----------------\n\nThe global ITAM market is expected to reach $10.3 billion by 2025, growing at a Compound Annual Growth Rate (CAGR) of 11.5% from 2020 to 2025 [3]. The increasing adoption of cloud services, IoT devices, and digital transformation initiatives are driving the growth of the ITAM market.\n\nThe AI in ITAM market is a subset of the larger ITAM market, and it is expected to grow at a faster rate. According to a report by Canalys, the AI in ITAM market is expected to reach $1.4 billion by 2025, growing at a CAGR of 25.6% from 2020 to 2025 [2].\n\n**Competitive Analysis**\n---------------------\n\nThe AI in ITAM market is highly competitive, with several players vying for market share. The key players in the market include:\n\n* **ServiceNow**: ServiceNow is a leading provider of ITAM solutions, and it has recently introduced AI-powered capabilities to its platform [8].\n* **BMC Software**: BMC Software is another leading provider of ITAM solutions, and it has also introduced AI-powered capabilities to its platform [8].\n* **IBM**: IBM is a leading provider of AI solutions, and it has a strong presence in the ITAM market [8].\n* **Hewlett Packard Enterprise (HPE)**: HPE is a leading provider of ITAM solutions, and it has introduced AI-powered capabilities to its platform [8].\n\n**AI in ITAM: Current Trends and Future Outlook**\n------------------------------------------------\n\n### Automation and Efficiency\n\nAI is being used to automate various ITAM processes, such as asset discovery, inventory management, and software license management. According to a report by Contentful, 92% of businesses are leveraging AI-driven personalization to drive customer experience [7].\n\n### Predictive Analytics\n\nAI-powered predictive analytics is being used to predict IT asset failures, reducing downtime and improving overall IT efficiency. According to a report by Frost & Sullivan, the predictive analytics market is expected to reach $10.9 billion by 2025, growing at a CAGR of 24.5% from 2020 to 2025 [10].\n\n### Chatbots and Virtual Assistants\n\nAI-powered chatbots and virtual assistants are being used to improve IT asset management, providing 24/7 support to IT teams and end-users. According to a report by Canalys, the chatbot market is expected to reach $1.3 billion by 2025, growing at a CAGR of 31.3% from 2020 to 2025 [2].\n\n### Cybersecurity\n\nAI is being used to improve IT asset security, detecting and responding to cyber threats in real-time. According to a report by Gartner, the cybersecurity market is expected to reach $300.4 billion by 2025, growing at a CAGR of 12.8% from 2020 to 2025 [8].\n\n**Actionable Insights and Recommendations**\n---------------------------------------------\n\n### Invest in AI-powered ITAM Solutions\n\nOrganizations should invest in AI-powered ITAM solutions to automate IT asset management processes, improve efficiency, and reduce costs.\n\n### Develop a Strong Data Management Strategy\n\nOrganizations should develop a strong data management strategy to ensure that their IT asset data is accurate, complete, and up-to-date.\n\n### Train IT Teams on AI-powered ITAM Solutions\n\nOrganizations should train their IT teams on AI-powered ITAM solutions to ensure that they can effectively use these solutions to manage IT assets.\n\n### Monitor the Market for Emerging Trends\n\nOrganizations should monitor the market for emerging trends and technologies, such as augmented reality (AR) and blockchain, which can be used to improve IT asset management.\n\n**Conclusion**\n----------\n\nThe AI in ITAM market is expected to grow significantly in the next few years, driven by the increasing need for automation, efficiency, and cost savings in IT asset management. Organizations should invest in AI-powered ITAM solutions, develop a strong data management strategy, train their IT teams on AI-powered ITAM solutions, and monitor the market for emerging trends and technologies.\n\n**References**\n--------------\n\n[1] Economic Research Service. (2025). Food Price Outlook - Summary Findings. Retrieved from <http://www.ers.usda.gov/data-products/food-price-outlook/summary-findings>\n\n[2] Canalys. (2025). Canalys, part of Informa TechTarget, is a leading global technology market analyst firm with a distinct channel focus. Retrieved from <https://canalys.com/>\n\n[3] Statista. (2025). IT industry in Japan - statistics and facts. Retrieved from <https://www.statista.com/topics/7755/it-industry-in-japan/>\n\n[4] Retail Summits. (2025). The New York Fashion eCommerce Summit jumped into the intricate world of fashion supply chains and innovative inventory strategies this morning, led by... Retrieved from <https://m.facebook.com/story.php?story_fbid=613813321235555&id=100078206764348>\n\n[5] CBRE Investment Management. (2025). Insights. Retrieved from <https://www.cbreim.com/insights>\n\n[6] Retail Summits. (2025). Retail Summits added a new photo. Retrieved from <https://m.facebook.com/100078206764348/photos/613811517902402/>\n\n[7] Contentful. (2025). 40 personalization statistics: The state of personalization in 2025. Retrieved from <https://www.contentful.com/blog/personalization-statistics/>\n\n[8] Gartner. (2025). Newsroom, Announcements and Media Contacts. Retrieved from <https://www.gartner.com/en/newsroom>\n\n[9] Mobidev. (2025). TOP 7 Retail Technology Trends: Innovation Meets Practicality. Retrieved from <https://mobidev.biz/blog/7-technology-trends-to-change-retail-industry>\n\n[10] Frost & Sullivan. (2025). Automotive Market | Automobile Industry Analysis | Automobile. Retrieved from <https://store.frost.com/industries/automotive.html>\n\n## References\n\n1. [Food Price Outlook - Summary Findings | Economic Research Service](http://www.ers.usda.gov/data-products/food-price-outlook/summary-findings) - www.ers.usda.gov\n2. [Canalys, part of Informa TechTarget, is a leading global technology ...](https://canalys.com/) - canalys.com\n3. [IT industry in Japan - statistics and facts | Statista](https://www.statista.com/topics/7755/it-industry-in-japan/) - www.statista.com\n4. [Retail Summits - The New York Fashion eCommerce Summit ...](https://m.facebook.com/story.php?story_fbid=613813321235555&id=100078206764348) - m.facebook.com\n5. [Insights | CBRE Investment Management](https://www.cbreim.com/insights) - www.cbreim.com\n6. [Retail Summits - Retail Summits added a new photo.](https://m.facebook.com/100078206764348/photos/613811517902402/) - m.facebook.com\n7. [40 personalization statistics: The state of personalization in 2025 ...](https://www.contentful.com/blog/personalization-statistics/) - www.contentful.com\n8. [Newsroom, Announcements and Media Contacts | Gartner](https://www.gartner.com/en/newsroom) - www.gartner.com\n9. [TOP 7 Retail Technology Trends: Innovation Meets Practicality](https://mobidev.biz/blog/7-technology-trends-to-change-retail-industry) - mobidev.biz\n10. [Automotive Market | Automobile Industry Analysis | Automobile ...](https://store.frost.com/industries/automotive.html) - store.frost.com\n",
    "generated_date": "2025-01-25T19:02:20.542516",
    "sections": [
        "Executive Summary",
        "Market Overview",
        "Competitive Analysis"
    ],
    "references": [
        {
            "title": "Food Price Outlook - Summary Findings | Economic Research Service",
            "url": "http://www.ers.usda.gov/data-products/food-price-outlook/summary-findings",
            "source": "www.ers.usda.gov"
        },
        {
            "title": "Canalys, part of Informa TechTarget, is a leading global technology ...",
            "url": "https://canalys.com/",
            "source": "canalys.com"
        },
        {
            "title": "IT industry in Japan - statistics and facts | Statista",
            "url": "https://www.statista.com/topics/7755/it-industry-in-japan/",
            "source": "www.statista.com"
        },
        {
            "title": "Retail Summits - The New York Fashion eCommerce Summit ...",
            "url": "https://m.facebook.com/story.php?story_fbid=613813321235555&id=100078206764348",
            "source": "m.facebook.com"
        },
        {
            "title": "Insights | CBRE Investment Management",
            "url": "https://www.cbreim.com/insights",
            "source": "www.cbreim.com"
        },
        {
            "title": "Retail Summits - Retail Summits added a new photo.",
            "url": "https://m.facebook.com/100078206764348/photos/613811517902402/",
            "source": "m.facebook.com"
        },
        {
            "title": "40 personalization statistics: The state of personalization in 2025 ...",
            "url": "https://www.contentful.com/blog/personalization-statistics/",
            "source": "www.contentful.com"
        },
        {
            "title": "Newsroom, Announcements and Media Contacts | Gartner",
            "url": "https://www.gartner.com/en/newsroom",
            "source": "www.gartner.com"
        },
        {
            "title": "TOP 7 Retail Technology Trends: Innovation Meets Practicality",
            "url": "https://mobidev.biz/blog/7-technology-trends-to-change-retail-industry",
            "source": "mobidev.biz"
        },
        {
            "title": "Automotive Market | Automobile Industry Analysis | Automobile ...",
            "url": "https://store.frost.com/industries/automotive.html",
            "source": "store.frost.com"
        }
    ]
}