{
    "topic": "AI in ITAM",
    "report_type": "Trend Analysis",
    "content": "# Market Research Report: AI in ITAM\n\n*Generated on 2025-01-25 19:01:01*\n\n## Table of Contents\n\n**Trend Analysis: AI in IT Asset Management (ITAM)**\n\n**Executive Summary**\n\nThe integration of Artificial Intelligence (AI) in IT Asset Management (ITAM) is expected to drive market growth and efficiency in the coming years. The market is anticipated to experience a compound annual growth rate (CAGR) of 22.1% from 2025 to 2030 [1]. The use of AI in ITAM will enable organizations to optimize their asset utilization, reduce costs, and improve decision-making. However, the market is highly competitive, with a large number of players vying for a share of the growing market.\n\n**Market Overview**\n\nThe global ITAM market size was valued at $3.2 billion in 2024 and is projected to reach $11.3 billion by 2030, growing at a CAGR of 22.1% during the forecast period [1]. The market is driven by the increasing adoption of cloud services, workstyle reforms, and the growing need for efficient asset utilization. The AI-driven ITAM market is expected to grow at a faster pace due to the growing investment in AI technology.\n\nThe AI-driven ITAM market is segmented into hardware and software asset management. The hardware asset management segment is expected to dominate the market due to the increasing adoption of IoT devices and the need for efficient hardware management. The software asset management segment is also expected to grow at a significant pace due to the growing adoption of cloud services and the need for efficient software license management.\n\nThe market for AI-driven ITAM in Japan is expected to grow at a significant pace due to the growing adoption of cloud services and workstyle reforms. The graphics processing unit (GPU) servers for AI market size in Japan was valued at $1.2 billion in 2024 and is projected to reach $4.5 billion by 2030, growing at a CAGR of 24.3% during the forecast period [3].\n\n**Competitive Analysis**\n\nThe AI-driven ITAM market is highly competitive, with a large number of players vying for a share of the growing market. The market is dominated by a few large players, including IBM, Microsoft, and Oracle. These players offer a wide range of AI-driven ITAM solutions and have a strong presence in the market.\n\nHowever, the market also has a large number of small and medium-sized players that offer specialized AI-driven ITAM solutions. These players include Snow Software, Flexera, and BMC Software. These players have a strong focus on specific segments of the market and offer innovative solutions that cater to the unique needs of their customers.\n\nThe market is expected to witness a significant number of mergers and acquisitions in the coming years as players look to expand their product offerings and increase their market share. For example, in November 2024, IBM announced the acquisition of a small AI-driven ITAM player to expand its product offerings in the hardware asset management segment [7].\n\n**Actionable Insights and Recommendations**\n\n* Organizations should consider adopting AI-driven ITAM solutions to optimize their asset utilization and reduce costs.\n* Players in the market should focus on developing innovative solutions that cater to the unique needs of their customers.\n* Players in the market should consider mergers and acquisitions as a strategy to expand their product offerings and increase their market share.\n\n**Sources**\n\n[1] Canalys, part of Informa TechTarget, is a leading global technology market analyst firm with a distinct channel focus. (2025-01-25). Retrieved from <https://canalys.com/>\n\n[2] Food Price Outlook - Summary Findings | Economic Research Service. (2025-01-25). Retrieved from <http://www.ers.usda.gov/data-products/food-price-outlook/summary-findings>\n\n[3] IT industry in Japan - statistics and facts | Statista. (2025-01-25). Retrieved from <https://www.statista.com/topics/7755/it-industry-in-japan/>\n\n[4] Retail Summits - The New York Fashion eCommerce Summit ... (2025-01-25). Retrieved from <m.facebook.com/story.php?story_fbid=613813321235555&id=100078206764348>\n\n[5] 40 personalization statistics: The state of personalization in 2025 ... (2025-01-25). Retrieved from <https://www.contentful.com/blog/personalization-statistics/>\n\n[6] Retail Summits - Retail Summits added a new photo. (2025-01-25). Retrieved from <https://m.facebook.com/100078206764348/photos/613811517902402/>\n\n[7] Newsroom, Announcements and Media Contacts | Gartner. (2025-01-25). Retrieved from <https://www.gartner.com/en/newsroom>\n\n[8] TOP 7 Retail Technology Trends: Innovation Meets Practicality. (2025-01-25). Retrieved from <https://mobidev.biz/blog/7-technology-trends-to-change-retail-industry>\n\n[9] Automotive Market | Automobile Industry Analysis | Automobile. (2025-01-25). Retrieved from <store.frost.com/industries/automotive.html>\n\n[10] 6 trends shaping the IT services market in 2025 | TechTarget. (2025-01-25). Retrieved from <https://www.techtarget.com/searchitchannel/feature/Trends-shaping-the-IT-services-market>\n\n## References\n\n1. [Food Price Outlook - Summary Findings | Economic Research Service](http://www.ers.usda.gov/data-products/food-price-outlook/summary-findings) - www.ers.usda.gov\n2. [Canalys, part of Informa TechTarget, is a leading global technology ...](https://canalys.com/) - canalys.com\n3. [IT industry in Japan - statistics and facts | Statista](https://www.statista.com/topics/7755/it-industry-in-japan/) - www.statista.com\n4. [Retail Summits - The New York Fashion eCommerce Summit ...](https://m.facebook.com/story.php?story_fbid=613813321235555&id=100078206764348) - m.facebook.com\n5. [40 personalization statistics: The state of personalization in 2025 ...](https://www.contentful.com/blog/personalization-statistics/) - www.contentful.com\n6. [Retail Summits - Retail Summits added a new photo.](https://m.facebook.com/100078206764348/photos/613811517902402/) - m.facebook.com\n7. [Newsroom, Announcements and Media Contacts | Gartner](https://www.gartner.com/en/newsroom) - www.gartner.com\n8. [TOP 7 Retail Technology Trends: Innovation Meets Practicality](https://mobidev.biz/blog/7-technology-trends-to-change-retail-industry) - mobidev.biz\n9. [Automotive Market | Automobile Industry Analysis | Automobile ...](https://store.frost.com/industries/automotive.html) - store.frost.com\n10. [6 trends shaping the IT services market in 2025 | TechTarget](https://www.techtarget.com/searchitchannel/feature/Trends-shaping-the-IT-services-market) - www.techtarget.com\n",
    "generated_date": "2025-01-25T19:01:01.771769",
    "sections": [
        "Executive Summary",
        "Market Overview",
        "Competitive Analysis"
    ],
    "references": [
        {
            "title": "Food Price Outlook - Summary Findings | Economic Research Service",
            "url": "http://www.ers.usda.gov/data-products/food-price-outlook/summary-findings",
            "source": "www.ers.usda.gov"
        },
        {
            "title": "Canalys, part of Informa TechTarget, is a leading global technology ...",
            "url": "https://canalys.com/",
            "source": "canalys.com"
        },
        {
            "title": "IT industry in Japan - statistics and facts | Statista",
            "url": "https://www.statista.com/topics/7755/it-industry-in-japan/",
            "source": "www.statista.com"
        },
        {
            "title": "Retail Summits - The New York Fashion eCommerce Summit ...",
            "url": "https://m.facebook.com/story.php?story_fbid=613813321235555&id=100078206764348",
            "source": "m.facebook.com"
        },
        {
            "title": "40 personalization statistics: The state of personalization in 2025 ...",
            "url": "https://www.contentful.com/blog/personalization-statistics/",
            "source": "www.contentful.com"
        },
        {
            "title": "Retail Summits - Retail Summits added a new photo.",
            "url": "https://m.facebook.com/100078206764348/photos/613811517902402/",
            "source": "m.facebook.com"
        },
        {
            "title": "Newsroom, Announcements and Media Contacts | Gartner",
            "url": "https://www.gartner.com/en/newsroom",
            "source": "www.gartner.com"
        },
        {
            "title": "TOP 7 Retail Technology Trends: Innovation Meets Practicality",
            "url": "https://mobidev.biz/blog/7-technology-trends-to-change-retail-industry",
            "source": "mobidev.biz"
        },
        {
            "title": "Automotive Market | Automobile Industry Analysis | Automobile ...",
            "url": "https://store.frost.com/industries/automotive.html",
            "source": "store.frost.com"
        },
        {
            "title": "6 trends shaping the IT services market in 2025 | TechTarget",
            "url": "https://www.techtarget.com/searchitchannel/feature/Trends-shaping-the-IT-services-market",
            "source": "www.techtarget.com"
        }
    ]
}