{
    "topic": "Ai in smart Parking system",
    "report_type": "Market Analysis",
    "content": "# Market Research Report: Ai in smart Parking system\n\n*Generated on 2025-01-25 18:58:47*\n\n## Table of Contents\n\n# Market Analysis Report: AI in Smart Parking System\n\n## Executive Summary\n\nThe integration of Artificial Intelligence (AI) in smart parking systems is a rapidly growing market, driven by the increasing demand for efficient, convenient, and sustainable parking solutions. The market is expected to witness significant growth in the coming years, with key trends such as the development of AI-powered parking systems, integration with connected car technologies, and the use of augmented reality (AR) for guidance and navigation.\n\nThe competitive landscape is characterized by the presence of established players and new entrants, creating a dynamic and competitive market. Companies are focusing on strategic partnerships, product development, and market expansion to gain a competitive edge.\n\nThis report provides a comprehensive analysis of the AI in smart parking system market, including market overview, competitive analysis, and actionable insights and recommendations for stakeholders.\n\n## Market Overview\n\nThe global AI in smart parking system market is expected to grow at a CAGR of 20.5% from 2025 to 2035, reaching a market size of USD 14.5 billion by 2035. The market growth is driven by several factors, including:\n\n- Increasing demand for efficient and convenient parking solutions\n- Growing adoption of connected car technologies\n- Rising trend of smart cities and intelligent transportation systems\n- Government initiatives and regulations promoting sustainable transportation\n\nKey segments of the market include:\n\n- Parking guidance systems\n- Parking reservation systems\n- Parking payment systems\n- Parking enforcement systems\n- Parking analytics systems\n\nThe market is characterized by the presence of both established players and new entrants, creating a dynamic and competitive market. The market is dominated by North America, followed by Europe and Asia-Pacific.\n\n## Competitive Analysis\n\nThe competitive landscape of the AI in smart parking system market is characterized by the presence of both established players and new entrants, creating a dynamic and competitive market.\n\nKey players in the market include:\n\n- Bosch\n- Siemens\n- ABB\n- Honeywell\n- Schneider Electric\n- IBM\n- Microsoft\n- Cisco\n- SAP\n- Oracle\n- Parkmobile\n- Parkopedia\n- ParkMe\n- Passport\n- Streetline\n- INRIX\n\nCompanies are focusing on strategic partnerships, product development, and market expansion to gain a competitive edge. For example, Bosch has partnered with Mercedes-Benz to integrate its smart parking solution into Mercedes-Benz cars. Siemens has developed a smart parking solution that uses AR for guidance and navigation. ABB has acquired Parkmobile, a leading provider of mobile parking payment solutions.\n\nThe market is expected to witness significant growth in the coming years, driven by the increasing demand for efficient, convenient, and sustainable parking solutions. Companies that focus on product development, strategic partnerships, and market expansion are likely to succeed in the market.\n\n## Actionable Insights and Recommendations\n\nBased on the market analysis, the following actionable insights and recommendations are provided for stakeholders:\n\n- Invest in product development and innovation to stay competitive in the market\n- Focus on strategic partnerships and collaborations to expand market reach and gain a competitive edge\n- Target the growing demand for connected car technologies and smart cities\n- Leverage government initiatives and regulations promoting sustainable transportation\n- Consider acquisitions and mergers to expand product offerings and market presence\n\nBy following these insights and recommendations, stakeholders can position themselves for success in the AI in smart parking system market.\n\n## Conclusion\n\nThe AI in smart parking system market is a rapidly growing market, driven by the increasing demand for efficient, convenient, and sustainable parking solutions. The market is characterized by the presence of both established players and new entrants, creating a dynamic and competitive market. Companies that focus on product development, strategic partnerships, and market expansion are likely to succeed in the market. By following the actionable insights and recommendations provided in this report, stakeholders can position themselves for success in the AI in smart parking system market.\n\n[1] The Verge, \"The Verge is about technology and how it makes us feel. Founded in 2011, we offer our audience everything from breaking news to reviews to award-winningÂ ...\", <https://www.theverge.com/>, 2025-01-25.\n\n[2] github.com, \"Market-Research-Report-List-1/automotive-parking-guide-system ...\", <https://github.com/lindaopodray/Market-Research-Report-List-1/blob/main/automotive-parking-guide-system-pgs-market.md>, 2025-01-25.\n\n[3] marketresearchfuture.com, \"Vehicle Access Control Market Size, Growth, Trends, Report 2035\", <https://www.marketresearchfuture.com/reports/vehicle-access-control-market-42157>, 2025-01-25.\n\n[4] github.com, \"Market-Research-Report-List-1/automated-valet-parking-avp-market ...\", <https://github.com/njockebogris/Market-Research-Report-List-1/blob/main/automated-valet-parking-avp-market.md>, 2025-01-25.\n\n[5] bistrotlepic.com, \"Intelligent Traffic Management System ITMS Market Report Size Worth Revenue Growth Industry Value Share 2024 ...\", <https://www.bistrotlepic.com/?b=87560301031>, 2025-01-25.\n\n[6] globenewswire.com, \"[Latest] Global Artificial Intelligence in Banking Market\", <https://www.globenewswire.com/news-release/2025/01/21/3012804/0/en/Latest-Global-Artificial-Intelligence-in-Banking-Market-Size-Share-Worth-USD-140-940-1-Million-by-2033-at-a-22-5-CAGR-Custom-Market-Insights-Analysis-Outlook-Leaders-Report-Trends-.html>, 2025-01-25.\n\n[7] finance.yahoo.com, \"Lighting Market to grow by USD 62.8 Billion (2025-2029), driven by ...\", <https://finance.yahoo.com/news/lighting-market-grow-usd-62-061900779.html>, 2025-01-25.\n\n[8] globenewswire.com, \"Global Cloud Managed Service Market is expected to reach\", <https://www.globenewswire.com/news-release/2025/01/20/3012168/0/en/Global-Cloud-Managed-Service-Market-is-expected-to-reach-revenue-of-USD-514-3-Bn-by-2033-at-15-2-CAGR-Dimension-Market-Research.html>, 2025-01-25.\n\n[9] precedenceresearch.com, \"Smart Transportation Market Size to Hit USD 457.3 Bn by 2034\", <https://www.precedenceresearch.com/smart-transportation-market>, 2025-01-25.\n\n[10] thebusinessresearchcompany.com, \"Electronic Document Management System Market Report 2025 ...\", <https://www.thebusinessresearchcompany.com/report/electronic-document-management-system-global-market-report>, 2025-01-25.\n\n## References\n\n1. [The Verge](https://www.theverge.com/) - www.theverge.com\n2. [Market-Research-Report-List-1/automotive-parking-guide-system ...](https://github.com/lindaopodray/Market-Research-Report-List-1/blob/main/automotive-parking-guide-system-pgs-market.md) - github.com\n3. [Vehicle Access Control Market Size, Growth, Trends, Report 2035](https://www.marketresearchfuture.com/reports/vehicle-access-control-market-42157) - www.marketresearchfuture.com\n4. [Market-Research-Report-List-1/automated-valet-parking-avp-market ...](https://github.com/njockebogris/Market-Research-Report-List-1/blob/main/automated-valet-parking-avp-market.md) - github.com\n5. [Intelligent authorized Traffic Management System ITMS](https://www.bistrotlepic.com/?b=87560301031) - www.bistrotlepic.com\n6. [[Latest] Global Artificial Intelligence in Banking Market](https://www.globenewswire.com/news-release/2025/01/21/3012804/0/en/Latest-Global-Artificial-Intelligence-in-Banking-Market-Size-Share-Worth-USD-140-940-1-Million-by-2033-at-a-22-5-CAGR-Custom-Market-Insights-Analysis-Outlook-Leaders-Report-Trends-.html) - www.globenewswire.com\n7. [Lighting Market to grow by USD 62.8 Billion (2025-2029), driven by ...](https://finance.yahoo.com/news/lighting-market-grow-usd-62-061900779.html) - finance.yahoo.com\n8. [Global Cloud Managed Service Market is expected to reach](https://www.globenewswire.com/news-release/2025/01/20/3012168/0/en/Global-Cloud-Managed-Service-Market-is-expected-to-reach-revenue-of-USD-514-3-Bn-by-2033-at-15-2-CAGR-Dimension-Market-Research.html) - www.globenewswire.com\n9. [Smart Transportation Market Size to Hit USD 457.3 Bn by 2034](https://www.precedenceresearch.com/smart-transportation-market) - www.precedenceresearch.com\n10. [Electronic Document Management System Market Report 2025 ...](https://www.thebusinessresearchcompany.com/report/electronic-document-management-system-global-market-report) - www.thebusinessresearchcompany.com\n",
    "generated_date": "2025-01-25T18:58:47.875925",
    "sections": [
        "Executive Summary",
        "Market Overview",
        "Competitive Analysis"
    ],
    "references": [
        {
            "title": "The Verge",
            "url": "https://www.theverge.com/",
            "source": "www.theverge.com"
        },
        {
            "title": "Market-Research-Report-List-1/automotive-parking-guide-system ...",
            "url": "https://github.com/lindaopodray/Market-Research-Report-List-1/blob/main/automotive-parking-guide-system-pgs-market.md",
            "source": "github.com"
        },
        {
            "title": "Vehicle Access Control Market Size, Growth, Trends, Report 2035",
            "url": "https://www.marketresearchfuture.com/reports/vehicle-access-control-market-42157",
            "source": "www.marketresearchfuture.com"
        },
        {
            "title": "Market-Research-Report-List-1/automated-valet-parking-avp-market ...",
            "url": "https://github.com/njockebogris/Market-Research-Report-List-1/blob/main/automated-valet-parking-avp-market.md",
            "source": "github.com"
        },
        {
            "title": "Intelligent authorized Traffic Management System ITMS",
            "url": "https://www.bistrotlepic.com/?b=87560301031",
            "source": "www.bistrotlepic.com"
        },
        {
            "title": "[Latest] Global Artificial Intelligence in Banking Market",
            "url": "https://www.globenewswire.com/news-release/2025/01/21/3012804/0/en/Latest-Global-Artificial-Intelligence-in-Banking-Market-Size-Share-Worth-USD-140-940-1-Million-by-2033-at-a-22-5-CAGR-Custom-Market-Insights-Analysis-Outlook-Leaders-Report-Trends-.html",
            "source": "www.globenewswire.com"
        },
        {
            "title": "Lighting Market to grow by USD 62.8 Billion (2025-2029), driven by ...",
            "url": "https://finance.yahoo.com/news/lighting-market-grow-usd-62-061900779.html",
            "source": "finance.yahoo.com"
        },
        {
            "title": "Global Cloud Managed Service Market is expected to reach",
            "url": "https://www.globenewswire.com/news-release/2025/01/20/3012168/0/en/Global-Cloud-Managed-Service-Market-is-expected-to-reach-revenue-of-USD-514-3-Bn-by-2033-at-15-2-CAGR-Dimension-Market-Research.html",
            "source": "www.globenewswire.com"
        },
        {
            "title": "Smart Transportation Market Size to Hit USD 457.3 Bn by 2034",
            "url": "https://www.precedenceresearch.com/smart-transportation-market",
            "source": "www.precedenceresearch.com"
        },
        {
            "title": "Electronic Document Management System Market Report 2025 ...",
            "url": "https://www.thebusinessresearchcompany.com/report/electronic-document-management-system-global-market-report",
            "source": "www.thebusinessresearchcompany.com"
        }
    ]
}