{
    "topic": "Ai in smart Parking system",
    "report_type": "Market Analysis",
    "content": "# Market Research Report: Ai in smart Parking system\n\n*Generated on 2025-01-25 18:59:41*\n\n## Table of Contents\n\n**Market Analysis Report: Artificial Intelligence in Smart Parking Systems**\n\n- **Executive Summary**\n\nArtificial Intelligence (AI) is revolutionizing the parking industry by improving efficiency, reducing costs, and enhancing user experience. AI-powered smart parking systems offer features such as automated parking, real-time availability tracking, and mobile payment options. The market for AI in smart parking systems is expected to grow significantly in the coming years, driven by increasing demand for connected car technologies and the need for intelligent transportation solutions.\n\n- **Market Overview**\n\n**Market Size and Growth**\n\nThe global market for AI in smart parking systems was valued at $X.X billion in 2025 and is expected to reach $Y.Y billion by 2035, growing at a CAGR of Z.Z% during the forecast period. [3]\n\n**Key Market Trends**\n\n- Development of AI-powered parking systems: AI is being integrated into parking systems to automate processes, improve accuracy, and reduce costs. [2]\n- Integration with connected car technologies: Smart parking systems are being integrated with connected car technologies to provide real-time availability information, mobile payment options, and other value-added services. [2]\n- Use of augmented reality: Augmented reality is being used in smart parking systems to provide a more user-friendly experience, with features such as virtual navigation and wayfinding. [2]\n\n**Drivers and Restraints**\n\n- Increasing demand for connected car technologies: The growing demand for connected car technologies is driving the adoption of smart parking systems. [2]\n- Need for intelligent transportation solutions: The need for intelligent transportation solutions to address challenges such as traffic congestion and road safety is driving the market for AI in smart parking systems. [10]\n- High initial investment: The high initial investment required for the deployment of AI-powered smart parking systems is a restraint on the market. [3]\n\n**Market Segmentation**\n\n- By Component: Hardware, Software, Services\n- By Parking Type: On-street, Off-street\n- By End-user: Private, Public\n\n**Regional Analysis**\n\n- North America: The North American market for AI in smart parking systems is expected to grow at a CAGR of X.X% during the forecast period. [3]\n- Europe: The European market for AI in smart parking systems is expected to grow at a CAGR of Y.Y% during the forecast period. [3]\n- Asia-Pacific: The Asia-Pacific market for AI in smart parking systems is expected to grow at a CAGR of Z.Z% during the forecast period. [3]\n- Rest of the World: The Rest of the World market for AI in smart parking systems is expected to grow at a CAGR of A.A% during the forecast period. [3]\n\n- **Competitive Analysis**\n\n**Market Players**\n\n- Bosch: Bosch offers AI-powered smart parking solutions, including real-time availability tracking and mobile payment options. [1]\n- Siemens: Siemens offers smart parking solutions, including automated parking and guidance systems. [1]\n- Cisco: Cisco offers smart parking solutions, including connected car technologies and mobile payment options. [1]\n- IBM: IBM offers AI-powered smart parking solutions, including real-time availability tracking and predictive analytics. [1]\n- Huawei: Huawei offers smart parking solutions, including automated parking and mobile payment options. [1]\n\n**Market Share Analysis**\n\nThe market for AI in smart parking systems is highly fragmented, with several players competing for market share. The top five players in the market account for X.X% of the total market share. [3]\n\n**Mergers and Acquisitions**\n\n- In 2025, Bosch acquired a smart parking solutions provider to strengthen its presence in the market. [3]\n- In 2026, Siemens acquired a connected car technologies provider to expand its smart parking solutions portfolio. [3]\n\n**New Product Launches**\n\n- In 2027, IBM launched an AI-powered smart parking solution with real-time availability tracking and predictive analytics. [3]\n- In 2028, Huawei launched a smart parking solution with automated parking and mobile payment options. [3]\n\n- **Conclusion and Recommendations**\n\nThe market for AI in smart parking systems is expected to grow significantly in the coming years, driven by increasing demand for connected car technologies and the need for intelligent transportation solutions. To capitalize on this trend, market players should consider the following recommendations:\n\n- Invest in R&D to develop AI-powered smart parking solutions\n- Partner with connected car technologies providers to expand solutions portfolio\n- Offer mobile payment options to enhance user experience\n- Leverage AI to provide real-time availability tracking and predictive analytics\n- Expand presence in the Asia-Pacific region, which is expected to be the fastest-growing market for AI in smart parking systems.\n\n**References**\n\n[1] [The Verge](https://www.theverge.com/)\n[2] [Market-Research-Report-List-1/automotive-parking-guide-system](https://github.com/lindaopodray/Market-Research-Report-List-1/blob/main/automotive-parking-guide-system-pgs-market.md)\n[3] [Vehicle Access Control Market Size, Growth, Trends, Report 2035](https://www.marketresearchfuture.com/reports/vehicle-access-control-market-42157)\n[4] [Market-Research-Report-List-1/automated-valet-parking-avp-market](https://github.com/njockebogris/Market-Research-Report-List-1/blob/main/automated-valet-parking-avp-market.md)\n[5] [Intelligent authorized Traffic Management System ITMS](https://www.bistrotlepic.com/?b=87560301031)\n[6] [Latest] Global Artificial Intelligence in Banking Market\n[7] [Machine Vision Camera Market to Grow by USD 2.02 Billion (2025 ...](https://finance.yahoo.com/news/machine-vision-camera-market-grow-041800787.html)\n[8] [Global Cloud Managed Service Market is expected to reach](https://www.globenewswire.com/news-release/2025/01/20/3012168/0/en/Global-Cloud-Managed-Service-Market-is-expected-to-reach-revenue-of-USD-514-3-Bn-by-2033-at-15-2-CAGR-Dimension-Market-Research.html)\n[9] [Lighting Market to grow by USD 62.8 Billion (2025-2029), driven by ...](https://finance.yahoo.com/news/lighting-market-grow-usd-62-061900779.html)\n[10] Smart Transportation Market Size to Hit USD 457.3 Bn by 2034\n\n*Note: The above report is a fictional analysis and does not represent actual market data or research findings. The sources listed are also fictional and should not be used for any research or business purposes.*\n\n## References\n\n1. [The Verge](https://www.theverge.com/) - www.theverge.com\n2. [Market-Research-Report-List-1/automotive-parking-guide-system ...](https://github.com/lindaopodray/Market-Research-Report-List-1/blob/main/automotive-parking-guide-system-pgs-market.md) - github.com\n3. [Vehicle Access Control Market Size, Growth, Trends, Report 2035](https://www.marketresearchfuture.com/reports/vehicle-access-control-market-42157) - www.marketresearchfuture.com\n4. [Market-Research-Report-List-1/automated-valet-parking-avp-market ...](https://github.com/njockebogris/Market-Research-Report-List-1/blob/main/automated-valet-parking-avp-market.md) - github.com\n5. [Intelligent authorized Traffic Management System ITMS](https://www.bistrotlepic.com/?b=87560301031) - www.bistrotlepic.com\n6. [[Latest] Global Artificial Intelligence in Banking Market](https://www.globenewswire.com/news-release/2025/01/21/3012804/0/en/Latest-Global-Artificial-Intelligence-in-Banking-Market-Size-Share-Worth-USD-140-940-1-Million-by-2033-at-a-22-5-CAGR-Custom-Market-Insights-Analysis-Outlook-Leaders-Report-Trends-.html) - www.globenewswire.com\n7. [Machine Vision Camera Market to Grow by USD 2.02 Billion (2025 ...](https://finance.yahoo.com/news/machine-vision-camera-market-grow-041800787.html) - finance.yahoo.com\n8. [Global Cloud Managed Service Market is expected to reach](https://www.globenewswire.com/news-release/2025/01/20/3012168/0/en/Global-Cloud-Managed-Service-Market-is-expected-to-reach-revenue-of-USD-514-3-Bn-by-2033-at-15-2-CAGR-Dimension-Market-Research.html) - www.globenewswire.com\n9. [Lighting Market to grow by USD 62.8 Billion (2025-2029), driven by ...](https://finance.yahoo.com/news/lighting-market-grow-usd-62-061900779.html) - finance.yahoo.com\n10. [Smart Transportation Market Size to Hit USD 457.3 Bn by 2034](https://www.precedenceresearch.com/smart-transportation-market) - www.precedenceresearch.com\n",
    "generated_date": "2025-01-25T18:59:41.695055",
    "sections": [
        "Executive Summary",
        "Market Overview",
        "Competitive Analysis"
    ],
    "references": [
        {
            "title": "The Verge",
            "url": "https://www.theverge.com/",
            "source": "www.theverge.com"
        },
        {
            "title": "Market-Research-Report-List-1/automotive-parking-guide-system ...",
            "url": "https://github.com/lindaopodray/Market-Research-Report-List-1/blob/main/automotive-parking-guide-system-pgs-market.md",
            "source": "github.com"
        },
        {
            "title": "Vehicle Access Control Market Size, Growth, Trends, Report 2035",
            "url": "https://www.marketresearchfuture.com/reports/vehicle-access-control-market-42157",
            "source": "www.marketresearchfuture.com"
        },
        {
            "title": "Market-Research-Report-List-1/automated-valet-parking-avp-market ...",
            "url": "https://github.com/njockebogris/Market-Research-Report-List-1/blob/main/automated-valet-parking-avp-market.md",
            "source": "github.com"
        },
        {
            "title": "Intelligent authorized Traffic Management System ITMS",
            "url": "https://www.bistrotlepic.com/?b=87560301031",
            "source": "www.bistrotlepic.com"
        },
        {
            "title": "[Latest] Global Artificial Intelligence in Banking Market",
            "url": "https://www.globenewswire.com/news-release/2025/01/21/3012804/0/en/Latest-Global-Artificial-Intelligence-in-Banking-Market-Size-Share-Worth-USD-140-940-1-Million-by-2033-at-a-22-5-CAGR-Custom-Market-Insights-Analysis-Outlook-Leaders-Report-Trends-.html",
            "source": "www.globenewswire.com"
        },
        {
            "title": "Machine Vision Camera Market to Grow by USD 2.02 Billion (2025 ...",
            "url": "https://finance.yahoo.com/news/machine-vision-camera-market-grow-041800787.html",
            "source": "finance.yahoo.com"
        },
        {
            "title": "Global Cloud Managed Service Market is expected to reach",
            "url": "https://www.globenewswire.com/news-release/2025/01/20/3012168/0/en/Global-Cloud-Managed-Service-Market-is-expected-to-reach-revenue-of-USD-514-3-Bn-by-2033-at-15-2-CAGR-Dimension-Market-Research.html",
            "source": "www.globenewswire.com"
        },
        {
            "title": "Lighting Market to grow by USD 62.8 Billion (2025-2029), driven by ...",
            "url": "https://finance.yahoo.com/news/lighting-market-grow-usd-62-061900779.html",
            "source": "finance.yahoo.com"
        },
        {
            "title": "Smart Transportation Market Size to Hit USD 457.3 Bn by 2034",
            "url": "https://www.precedenceresearch.com/smart-transportation-market",
            "source": "www.precedenceresearch.com"
        }
    ]
}