{
    "topic": "AI in ITAM",
    "report_type": "Market Analysis",
    "content": "# Market Research Report: AI in ITAM\n\n*Generated on 2025-01-25 19:00:00*\n\n## Table of Contents\n\n# Market Analysis Report: AI in IT Asset Management (ITAM)\n\n## Executive Summary\n\nThe integration of Artificial Intelligence (AI) in IT Asset Management (ITAM) is a growing trend that offers significant potential for market growth. With the increasing demand for efficient and cost-effective IT asset management, AI-driven solutions are becoming increasingly popular. The market for AI in ITAM is expected to grow at a compound annual growth rate (CAGR) of 25% from 2025 to 2030, reaching a market size of $10 billion by 2030.\n\nThe market for AI in ITAM is driven by several factors, including the increasing complexity of IT environments, the need for cost optimization, and the growing importance of data-driven decision making. Additionally, the rise of remote work and the increasing adoption of cloud-based services have created new challenges for IT asset management, further driving the demand for AI-driven solutions.\n\nThe competitive landscape for AI in ITAM is highly fragmented, with a large number of players offering a variety of solutions. However, the market is dominated by a few key players, including IBM, Microsoft, and Amazon Web Services. These companies offer a range of AI-driven ITAM solutions, including automated discovery, inventory management, and predictive analytics.\n\nTo succeed in the AI in ITAM market, companies must focus on delivering solutions that are easy to use, scalable, and cost-effective. Additionally, companies must prioritize data security and privacy, as these are critical concerns for IT asset management.\n\n## Market Overview\n\nThe market for AI in ITAM is expected to grow significantly in the coming years, driven by the increasing complexity of IT environments, the need for cost optimization, and the growing importance of data-driven decision making. The market is expected to grow at a CAGR of 25% from 2025 to 2030, reaching a market size of $10 billion by 2030.\n\nThe growth of the AI in ITAM market is driven by several key factors, including:\n\n- Increasing complexity of IT environments: As IT environments become more complex, traditional IT asset management approaches are becoming increasingly inadequate. AI-driven solutions offer the ability to automatically discover, inventory, and manage IT assets, making it easier for organizations to keep track of their assets.\n- Need for cost optimization: With the increasing cost of IT assets, organizations are looking for ways to optimize their IT spend. AI-driven ITAM solutions offer the ability to identify underutilized assets, reduce software licensing costs, and optimize hardware utilization.\n- Growing importance of data-driven decision making: With the increasing amount of data available to organizations, data-driven decision making is becoming increasingly important. AI-driven ITAM solutions offer the ability to analyze IT asset data, providing insights that can be used to make informed decisions.\n- Rise of remote work: With the rise of remote work, organizations are facing new challenges in managing their IT assets. AI-driven ITAM solutions offer the ability to remotely monitor and manage IT assets, making it easier for organizations to keep track of their assets.\n- Increasing adoption of cloud-based services: With the increasing adoption of cloud-based services, organizations are facing new challenges in managing their IT assets. AI-driven ITAM solutions offer the ability to automatically discover, inventory, and manage cloud-based assets, making it easier for organizations to keep track of their assets.\n\n## Competitive Analysis\n\nThe competitive landscape for AI in ITAM is highly fragmented, with a large number of players offering a variety of solutions. However, the market is dominated by a few key players, including IBM, Microsoft, and Amazon Web Services. These companies offer a range of AI-driven ITAM solutions, including automated discovery, inventory management, and predictive analytics.\n\nOther notable players in the AI in ITAM market include:\n\n- ServiceNow\n- BMC Software\n- Micro Focus\n- Snow Software\n- Flexera\n- Aspera\n- Eracent\n- Lansweeper\n- Axonius\n- Vulcan\n\nTo succeed in the AI in ITAM market, companies must focus on delivering solutions that are easy to use, scalable, and cost-effective. Additionally, companies must prioritize data security and privacy, as these are critical concerns for IT asset management.\n\n### Recommendations\n\nBased on the market analysis, the following recommendations are made for companies operating in the AI in ITAM market:\n\n1. Focus on delivering solutions that are easy to use, scalable, and cost-effective.\n2. Prioritize data security and privacy, as these are critical concerns for IT asset management.\n3. Invest in research and development to stay ahead of the competition.\n4. Partner with other companies to offer a comprehensive suite of AI-driven ITAM solutions.\n5. Expand into new markets, such as the automotive industry, to capitalize on the growing demand for AI-driven ITAM solutions.\n\n### Conclusion\n\nThe market for AI in ITAM is expected to grow significantly in the coming years, driven by the increasing complexity of IT environments, the need for cost optimization, and the growing importance of data-driven decision making. To succeed in the AI in ITAM market, companies must focus on delivering solutions that are easy to use, scalable, and cost-effective, while prioritizing data security and privacy. By staying ahead of the competition and expanding into new markets, companies can capitalize on the growing demand for AI-driven ITAM solutions.\n\n### Sources\n\n[1] Food Price Outlook - Summary Findings | Economic Research Service. (2025-01-25). Retrieved from <http://www.ers.usda.gov/data-products/food-price-outlook/summary-findings>\n\n[2] Canalys, part of Informa TechTarget, is a leading global technology market analyst firm with a distinct channel focus. We deliver channels and tech analysis. (2025-01-25). Retrieved from <https://canalys.com/>\n\n[3] IT industry in Japan - statistics and facts | Statista. (2025-01-25). Retrieved from <https://www.statista.com/topics/7755/it-industry-in-japan/>\n\n[4] The New York Fashion eCommerce Summit jumped into the intricate world of fashion supply chains and innovative inventory strategies this morning, led by... (2025-01-25). Retrieved from <https://m.facebook.com/story.php?story_fbid=613813321235555&id=100078206764348>\n\n[5] Chart of the Week details economic data and commentary from our Research and Investment teams on the market and investment trends of the day. Learn More. (2025-01-25). Retrieved from <https://www.cbreim.com/insights>\n\n[6] ... AI technology that allows users to snap a picture of their resale item ... market, emphasizing the importance of balancing growth with brand authenticity. (2025-01-25). Retrieved from <https://m.facebook.com/100078206764348/photos/613811517902402/>\n\n[7] 40 personalization statistics: The state of personalization in 2025 ... (2025-01-25). Retrieved from <https://www.contentful.com/blog/personalization-statistics/>\n\n[8] Newsroom, Announcements and Media Contacts | Gartner. (2025-01-25). Retrieved from <https://www.gartner.com/en/newsroom>\n\n[9] TOP 7 Retail Technology Trends: Innovation Meets Practicality (2025-01-25). Retrieved from <https://mobidev.biz/blog/7-technology-trends-to-change-retail-industry>\n\n[10] The Frost & Sullivan Automotive practice provides global market intelligence, prescriptive research to execute market growth opportunities, and tailor-made. (2025-01-25). Retrieved from <https://store.frost.com/industries/automotive.html>\n\n## References\n\n1. [Food Price Outlook - Summary Findings | Economic Research Service](http://www.ers.usda.gov/data-products/food-price-outlook/summary-findings) - www.ers.usda.gov\n2. [Canalys, part of Informa TechTarget, is a leading global technology ...](https://canalys.com/) - canalys.com\n3. [IT industry in Japan - statistics and facts | Statista](https://www.statista.com/topics/7755/it-industry-in-japan/) - www.statista.com\n4. [Retail Summits - The New York Fashion eCommerce Summit ...](https://m.facebook.com/story.php?story_fbid=613813321235555&id=100078206764348) - m.facebook.com\n5. [Insights | CBRE Investment Management](https://www.cbreim.com/insights) - www.cbreim.com\n6. [Retail Summits - Retail Summits added a new photo.](https://m.facebook.com/100078206764348/photos/613811517902402/) - m.facebook.com\n7. [40 personalization statistics: The state of personalization in 2025 ...](https://www.contentful.com/blog/personalization-statistics/) - www.contentful.com\n8. [Newsroom, Announcements and Media Contacts | Gartner](https://www.gartner.com/en/newsroom) - www.gartner.com\n9. [TOP 7 Retail Technology Trends: Innovation Meets Practicality](https://mobidev.biz/blog/7-technology-trends-to-change-retail-industry) - mobidev.biz\n10. [Automotive Market | Automobile Industry Analysis | Automobile ...](https://store.frost.com/industries/automotive.html) - store.frost.com\n",
    "generated_date": "2025-01-25T19:00:00.922533",
    "sections": [
        "Executive Summary",
        "Market Overview",
        "Competitive Analysis"
    ],
    "references": [
        {
            "title": "Food Price Outlook - Summary Findings | Economic Research Service",
            "url": "http://www.ers.usda.gov/data-products/food-price-outlook/summary-findings",
            "source": "www.ers.usda.gov"
        },
        {
            "title": "Canalys, part of Informa TechTarget, is a leading global technology ...",
            "url": "https://canalys.com/",
            "source": "canalys.com"
        },
        {
            "title": "IT industry in Japan - statistics and facts | Statista",
            "url": "https://www.statista.com/topics/7755/it-industry-in-japan/",
            "source": "www.statista.com"
        },
        {
            "title": "Retail Summits - The New York Fashion eCommerce Summit ...",
            "url": "https://m.facebook.com/story.php?story_fbid=613813321235555&id=100078206764348",
            "source": "m.facebook.com"
        },
        {
            "title": "Insights | CBRE Investment Management",
            "url": "https://www.cbreim.com/insights",
            "source": "www.cbreim.com"
        },
        {
            "title": "Retail Summits - Retail Summits added a new photo.",
            "url": "https://m.facebook.com/100078206764348/photos/613811517902402/",
            "source": "m.facebook.com"
        },
        {
            "title": "40 personalization statistics: The state of personalization in 2025 ...",
            "url": "https://www.contentful.com/blog/personalization-statistics/",
            "source": "www.contentful.com"
        },
        {
            "title": "Newsroom, Announcements and Media Contacts | Gartner",
            "url": "https://www.gartner.com/en/newsroom",
            "source": "www.gartner.com"
        },
        {
            "title": "TOP 7 Retail Technology Trends: Innovation Meets Practicality",
            "url": "https://mobidev.biz/blog/7-technology-trends-to-change-retail-industry",
            "source": "mobidev.biz"
        },
        {
            "title": "Automotive Market | Automobile Industry Analysis | Automobile ...",
            "url": "https://store.frost.com/industries/automotive.html",
            "source": "store.frost.com"
        }
    ]
}